{"certification":{"all_source_member_sha256_values_recomputed":true,"byte_complete_legacy_reconstruction":true,"corruption_injection_detected":true,"deterministic_second_encoding_identical":true,"independent_observation_count":100000,"independent_physical_attempt_count":100500,"legacy_identity_recomputation_preserved":true,"maximum_objects_per_random_lookup":35,"random_lookup_samples_verified":3,"source_member_count":807,"two_non_crediting_attempt_segments_preserved":true},"classification":{"authoritative_format":true,"derived_analytics_authoritative":false,"docker_accessed":false,"material_r2_publication_performed":false,"paid_capacity_authorized":false,"source_corpus_read_only":true,"warehouse_or_parquet_authoritative":false},"decision_gate":{"conservative_below_hard_cap":true,"conservative_below_soft_stop":true,"material_r2_publication_authorized_by_report":false,"p20_t02_entry_capacity_gate_passed":true,"program_owner_review_required":false},"diagnostic_and_performance_contract":{"availability_counts":{"adapter-protocol-environment":{"derived":100500,"observed":0,"observed-absence-or-not-applicable":0,"unavailable":0},"anomaly-classification":{"derived":0,"observed":0,"observed-absence-or-not-applicable":0,"unavailable":100500},"compile-duration":{"derived":0,"observed":0,"observed-absence-or-not-applicable":0,"unavailable":100500},"configured-resource-limits":{"derived":100500,"observed":0,"observed-absence-or-not-applicable":0,"unavailable":0},"configured-timeout":{"derived":100500,"observed":0,"observed-absence-or-not-applicable":0,"unavailable":0},"containment-event":{"derived":0,"observed":0,"observed-absence-or-not-applicable":100000,"unavailable":500},"cpu-time":{"derived":0,"observed":0,"observed-absence-or-not-applicable":0,"unavailable":100500},"discrepancy-relationship":{"derived":0,"observed":0,"observed-absence-or-not-applicable":0,"unavailable":100500},"execution-duration":{"derived":0,"observed":0,"observed-absence-or-not-applicable":0,"unavailable":100500},"failure-attribution":{"derived":0,"observed":100500,"observed-absence-or-not-applicable":0,"unavailable":0},"failure-stage":{"derived":0,"observed":19231,"observed-absence-or-not-applicable":73076,"unavailable":8193},"monotonic-duration":{"derived":0,"observed":100000,"observed-absence-or-not-applicable":0,"unavailable":500},"native-diagnostic":{"derived":0,"observed":19231,"observed-absence-or-not-applicable":73076,"unavailable":8193},"native-error-category":{"derived":0,"observed":19231,"observed-absence-or-not-applicable":73076,"unavailable":8193},"native-error-code":{"derived":0,"observed":19231,"observed-absence-or-not-applicable":73076,"unavailable":8193},"native-error-message":{"derived":0,"observed":19231,"observed-absence-or-not-applicable":73076,"unavailable":8193},"native-error-position":{"derived":0,"observed":15384,"observed-absence-or-not-applicable":76923,"unavailable":8193},"native-error-position-basis":{"derived":0,"observed":0,"observed-absence-or-not-applicable":73076,"unavailable":27424},"operation":{"derived":8193,"observed":92307,"observed-absence-or-not-applicable":0,"unavailable":0},"peak-rss-or-memory-delta":{"derived":0,"observed":0,"observed-absence-or-not-applicable":0,"unavailable":100500},"process-exit-status":{"derived":0,"observed":100000,"observed-absence-or-not-applicable":0,"unavailable":500},"redaction-metadata":{"derived":0,"observed":0,"observed-absence-or-not-applicable":0,"unavailable":100500},"release-transition-relationship":{"derived":0,"observed":0,"observed-absence-or-not-applicable":0,"unavailable":100500},"replication-relationship":{"derived":0,"observed":0,"observed-absence-or-not-applicable":0,"unavailable":100500},"resource-limit-violation":{"derived":0,"observed":0,"observed-absence-or-not-applicable":100000,"unavailable":500},"retry-predecessor-relationship":{"derived":500,"observed":0,"observed-absence-or-not-applicable":100000,"unavailable":0},"runtime-backend-jit":{"derived":100500,"observed":0,"observed-absence-or-not-applicable":0,"unavailable":0},"signal-or-termination":{"derived":0,"observed":0,"observed-absence-or-not-applicable":100000,"unavailable":500},"stderr":{"derived":0,"observed":100000,"observed-absence-or-not-applicable":0,"unavailable":500},"stdout":{"derived":0,"observed":100000,"observed-absence-or-not-applicable":0,"unavailable":500},"timeout-source":{"derived":0,"observed":0,"observed-absence-or-not-applicable":0,"unavailable":100500},"triggered-timeout-or-limit":{"derived":0,"observed":0,"observed-absence-or-not-applicable":100000,"unavailable":500},"truncation-metadata":{"derived":0,"observed":0,"observed-absence-or-not-applicable":0,"unavailable":100500},"wall-duration":{"derived":100500,"observed":0,"observed-absence-or-not-applicable":0,"unavailable":0},"warm-up-state":{"derived":0,"observed":0,"observed-absence-or-not-applicable":0,"unavailable":100500}},"availability_field_count":35,"availability_representation":"two-bit-row-major-v1","content_addressed_diagnostic_payloads":true,"derived_statistics_authoritative":false,"empty_success_diagnostic_is_compact":true,"raw_integer_sample_arrays_supported":true,"raw_p19_process_wall_time_sample_count":4249},"forecast":{"canary_multiplier":"1.25","cases":{"conservative":{"base_historical_logical_executions":120234321,"bytes_before_growth_allowances":5003427721,"bytes_by_evidence_class":{"canonical_inputs":400530584,"diagnostics":108898200,"manifests_integrity":473382063,"performance_resource_samples":20883984,"physical_attempt_facts":240005653,"semantic_results":215532045,"shared_dictionary_cas":3544195192},"canary_platform_logical_executions":30058581,"class_a_requests":312832,"class_b_requests":312832,"diagnostic_growth_allowance_bytes":500342773,"exceeds_hard_cap":false,"exceeds_soft_stop":false,"general_growth_reserve_bytes":500000000,"logical_executions":150292902,"object_count":312832,"performance_growth_allowance_bytes":250171387,"physical_attempts":157807548,"qualification_corpus_bytes":3318573,"retry_overhead_attempts":7514646,"retry_overhead_bytes":17608948,"targeted_expansion_allowance_bytes":500000000,"total_retained_bytes":6757260454},"expected":{"base_historical_logical_executions":64857612,"bytes_before_growth_allowances":2690434005,"bytes_by_evidence_class":{"canonical_inputs":216056920,"diagnostics":56225065,"manifests_integrity":255354958,"performance_resource_samples":10782579,"physical_attempt_facts":123916955,"semantic_results":116263756,"shared_dictionary_cas":1911833772},"canary_platform_logical_executions":16214403,"class_a_requests":168896,"class_b_requests":168896,"diagnostic_growth_allowance_bytes":107617361,"exceeds_hard_cap":false,"exceeds_soft_stop":false,"general_growth_reserve_bytes":0,"logical_executions":81072015,"object_count":168896,"performance_growth_allowance_bytes":26904341,"physical_attempts":81477376,"qualification_corpus_bytes":3318573,"retry_overhead_attempts":405361,"retry_overhead_bytes":949877,"targeted_expansion_allowance_bytes":0,"total_retained_bytes":2828274280},"lower":{"base_historical_logical_executions":27519672,"bytes_before_growth_allowances":1141172470,"bytes_by_evidence_class":{"canonical_inputs":91674908,"diagnostics":23738114,"manifests_integrity":108349421,"performance_resource_samples":4552384,"physical_attempt_facts":52317498,"semantic_results":49331765,"shared_dictionary_cas":811208380},"canary_platform_logical_executions":6879918,"class_a_requests":71760,"class_b_requests":71760,"diagnostic_growth_allowance_bytes":0,"exceeds_hard_cap":false,"exceeds_soft_stop":false,"general_growth_reserve_bytes":0,"logical_executions":34399590,"object_count":71760,"performance_growth_allowance_bytes":0,"physical_attempts":34399590,"qualification_corpus_bytes":3318573,"retry_overhead_attempts":0,"retry_overhead_bytes":0,"targeted_expansion_allowance_bytes":0,"total_retained_bytes":1144491043}},"conservative_operating_reserve_below_soft_stop_bytes":1242739546,"hard_cap_bytes":10000000000,"measured_manifest_bytes":314885,"object_count_per_100k_pack_including_manifest":208,"soft_stop_bytes":8000000000,"source_denominators":{"conservative":{"logical_executions":360702963,"physical_attempts":378738112},"expected":{"logical_executions":129715224,"physical_attempts":130363801},"lower":{"logical_executions":34399590,"physical_attempts":34399590}},"zero_normal_list_requests":true},"pack_measurement":{"bytes_by_evidence_class":{"canonical_inputs":266500,"diagnostics":69352,"manifests_integrity":314973,"performance_resource_samples":13300,"physical_attempt_facts":152848,"semantic_results":143408,"shared_dictionary_cas":2358192},"bytes_per_logical_execution":"33.185730000","bytes_per_physical_attempt":"33.020626866","manifest_sha256":"6811186f105199f03cc65fad90edc4f9af318ac17ed52c2a42a52a08cb07530d","object_count_including_manifest":208,"pack_digest_sha256":"d236a89599e85b1b1dfaadc8e09cd2907fe4f351d782c068ff7ed5aa58365a06","retained_bytes":3318573},"platform_policy":{"canary_classes":["semantic","diagnostic","infrastructure-noise","performance-only"],"canary_required_for_every_materially_plausible_dimension":true,"full_expansion_requires_material_semantic_divergence":true,"unrelated_scope_expansion_forbidden":true},"publication_contract":{"conditional_create":true,"content_addressed_immutable_keys":true,"durable_local_receipts":true,"exact_read_back_sha256":true,"hard_cap_pre_upload_admission":true,"incremental_upload":true,"manifest_last":true,"normal_list_requests":0,"retries_only_after_failure_or_indeterminate_result":true,"soft_stop_pre_upload_admission":true},"report_digest_sha256":"112ce2a3d2496680ed3132372047b979b2375d6a04a6fc7f7eab7ea4bf7d4bee","schema_version":"evidence-pack-v2-certification.v1","source_binding":{"authoritative_member_count":807,"authoritative_raw_bytes":386855397,"campaign":"P19 Session 05 100K qualification","evidence_manifest_sha256":"a2d8d1c460d7822bc2212df41d41842e02202961caad7bc17ca1b68204ae07fa","logical_execution_count":100000,"physical_attempt_